{
  "id": "taskdeck.whisperx",
  "version": "1.0.0",
  "displayName": "WhisperX Local",
  "capabilities": ["audio.transcribe", "audio.align", "audio.diarize"],
  "execution": "sidecar",
  "locality": "local",
  "accepts": ["audio/*", "video/mp4", "video/webm"],
  "languages": ["*"],
  "features": ["vad", "segment-timestamps", "word-timestamps", "speaker-labels", "cpu-fallback"],
  "resources": {
    "cpu": true,
    "gpu": "optional",
    "minVramMb": 0,
    "estimatedRamMb": 4096
  },
  "privacy": {
    "networkRequired": false,
    "allowedHosts": [],
    "dataClasses": ["audio", "metadata"],
    "supportsRegionalRouting": false
  },
  "costModel": {
    "type": "compute-time",
    "currency": "USD",
    "unitPrice": 0
  },
  "outputSchemas": [
    "https://taskdeck.dev/schemas/transcript-representation.v1.json"
  ]
}
